{
  "npc_id": "TODO_XING_LINGER",
  "name": "星铃儿",
  "aliases": ["星凝"],
  "faction_id": "xinggong",
  "base_skill": {
    "identity": "待补充：星宫传人/星宫宫主。",
    "personality": [],
    "speech_style": [],
    "values": [],
    "knowledge_scope": [],
    "forbidden_behavior": []
  },
  "relationship_overrides": {}
}
